{
  "version": "0.1.0",
  "generated_on": "2026-07-13",
  "scientific_status": "provisional",
  "nodes": [
    {"id":"paper:1907.11157","type":"paper","label":"Quantum Error Correction: An Introductory Guide","properties":{"arxiv":"1907.11157"}},
    {"id":"paper:2306.09767","type":"paper","label":"Union-find quantum decoding without union-find","properties":{"arxiv":"2306.09767"}},
    {"id":"paper:2312.10950","type":"paper","label":"Belief Propagation Decoding of Quantum LDPC Codes with Guided Decimation","properties":{"arxiv":"2312.10950"}},
    {"id":"paper:2408.10001","type":"paper","label":"Coprime Bivariate Bicycle Codes","properties":{"arxiv":"2408.10001"}},
    {"id":"paper:2509.22347","type":"paper","label":"Decoding quantum low density parity check codes with diffusion","properties":{"arxiv":"2509.22347"}},
    {"id":"paper:2510.05211","type":"paper","label":"Self-dual bivariate bicycle codes with transversal Clifford gates","properties":{"arxiv":"2510.05211"}},
    {"id":"paper:2602.07578","type":"paper","label":"BiBiEQ: Bivariate Bicycle Codes on Erasure Qubits","properties":{"arxiv":"2602.07578"}},
    {"id":"code:qec","type":"code_family","label":"Quantum error-correcting codes","properties":{}},
    {"id":"code:surface","type":"code_family","label":"Surface codes","properties":{}},
    {"id":"code:qldpc","type":"code_family","label":"Quantum LDPC codes","properties":{}},
    {"id":"code:bb","type":"code_family","label":"Bivariate bicycle codes","properties":{}},
    {"id":"code:self-dual-bb","type":"code_family","label":"Self-dual bivariate bicycle codes","properties":{}},
    {"id":"decoder:union-find","type":"decoder","label":"Union-find decoding","properties":{}},
    {"id":"decoder:bpgd","type":"decoder","label":"Belief propagation with guided decimation","properties":{}},
    {"id":"decoder:bposd","type":"decoder","label":"Belief propagation with ordered statistics decoding","properties":{}},
    {"id":"decoder:diffusion","type":"decoder","label":"Diffusion-based neural decoder","properties":{}},
    {"id":"noise:erasure","type":"noise_model","label":"Erasure noise","properties":{}},
    {"id":"noise:circuit-level","type":"noise_model","label":"Circuit-level noise","properties":{}},
    {"id":"concept:transversal-clifford","type":"concept","label":"Transversal Clifford gates","properties":{}},
    {"id":"concept:code-search","type":"concept","label":"Algebraic code search","properties":{}}
  ],
  "edges": [
    {"id":"e001","source":"paper:1907.11157","target":"code:qec","type":"studies","source_paper_id":"arxiv-1907.11157","evidence_file":"phase2/evidence/arxiv-1907.11157.evidence.json","evidence_ids":["pending-id-normalization"],"review_status":"provisional","confidence":0.80,"notes":"Introductory synthesis; exact evidence-object IDs to be normalized."},
    {"id":"e002","source":"paper:1907.11157","target":"code:surface","type":"studies","source_paper_id":"arxiv-1907.11157","evidence_file":"phase2/evidence/arxiv-1907.11157.evidence.json","evidence_ids":["pending-id-normalization"],"review_status":"provisional","confidence":0.75,"notes":"Surface-code discussion is represented in the extraction."},
    {"id":"e003","source":"paper:2306.09767","target":"decoder:union-find","type":"implements","source_paper_id":"arxiv-2306.09767","evidence_file":"phase2/evidence/arxiv-2306.09767.evidence.json","evidence_ids":["pending-id-normalization"],"review_status":"provisional","confidence":0.90,"notes":"Algorithmic decoder relationship."},
    {"id":"e004","source":"paper:2306.09767","target":"code:surface","type":"targets","source_paper_id":"arxiv-2306.09767","evidence_file":"phase2/evidence/arxiv-2306.09767.evidence.json","evidence_ids":["pending-id-normalization"],"review_status":"provisional","confidence":0.85,"notes":"Target code family."},
    {"id":"e005","source":"paper:2312.10950","target":"decoder:bpgd","type":"implements","source_paper_id":"arxiv-2312.10950","evidence_file":"phase2/evidence/arxiv-2312.10950.evidence.json","evidence_ids":["pending-id-normalization"],"review_status":"provisional","confidence":0.95,"notes":"Primary algorithm introduced by the paper."},
    {"id":"e006","source":"paper:2312.10950","target":"code:qldpc","type":"targets","source_paper_id":"arxiv-2312.10950","evidence_file":"phase2/evidence/arxiv-2312.10950.evidence.json","evidence_ids":["pending-id-normalization"],"review_status":"provisional","confidence":0.90,"notes":"Decoder is evaluated for QLDPC codes."},
    {"id":"e007","source":"decoder:bpgd","target":"decoder:bposd","type":"compares_with","source_paper_id":"arxiv-2312.10950","evidence_file":"phase2/evidence/arxiv-2312.10950.evidence.json","evidence_ids":["pending-id-normalization"],"review_status":"provisional","confidence":0.80,"notes":"Comparison requires locator-level human validation."},
    {"id":"e008","source":"paper:2408.10001","target":"code:bb","type":"studies","source_paper_id":"arxiv-2408.10001","evidence_file":"phase2/evidence/arxiv-2408.10001.evidence.json","evidence_ids":["pending-id-normalization"],"review_status":"provisional","confidence":0.95,"notes":"Primary code family."},
    {"id":"e009","source":"paper:2408.10001","target":"concept:code-search","type":"implements","source_paper_id":"arxiv-2408.10001","evidence_file":"phase2/evidence/arxiv-2408.10001.evidence.json","evidence_ids":["pending-id-normalization"],"review_status":"provisional","confidence":0.85,"notes":"Algorithmic construction/search relationship."},
    {"id":"e010","source":"paper:2509.22347","target":"decoder:diffusion","type":"implements","source_paper_id":"arxiv-2509.22347","evidence_file":"phase2/evidence/arxiv-2509.22347.evidence.json","evidence_ids":["pending-id-normalization"],"review_status":"provisional","confidence":0.95,"notes":"Primary neural decoding method."},
    {"id":"e011","source":"paper:2509.22347","target":"code:qldpc","type":"targets","source_paper_id":"arxiv-2509.22347","evidence_file":"phase2/evidence/arxiv-2509.22347.evidence.json","evidence_ids":["pending-id-normalization"],"review_status":"provisional","confidence":0.90,"notes":"QLDPC application domain."},
    {"id":"e012","source":"decoder:diffusion","target":"decoder:bposd","type":"compares_with","source_paper_id":"arxiv-2509.22347","evidence_file":"phase2/evidence/arxiv-2509.22347.evidence.json","evidence_ids":["pending-id-normalization"],"review_status":"provisional","confidence":0.75,"notes":"Performance comparison must be reviewed with matched code/noise conditions."},
    {"id":"e013","source":"paper:2510.05211","target":"code:self-dual-bb","type":"studies","source_paper_id":"arxiv-2510.05211","evidence_file":"phase2/evidence/arxiv-2510.05211.evidence.json","evidence_ids":["pending-id-normalization"],"review_status":"provisional","confidence":0.95,"notes":"Primary code family."},
    {"id":"e014","source":"code:self-dual-bb","target":"concept:transversal-clifford","type":"supports","source_paper_id":"arxiv-2510.05211","evidence_file":"phase2/evidence/arxiv-2510.05211.evidence.json","evidence_ids":["pending-id-normalization"],"review_status":"provisional","confidence":0.85,"notes":"Theorem-level relation; exact conditions must be retained during review."},
    {"id":"e015","source":"code:self-dual-bb","target":"code:bb","type":"extends","source_paper_id":"arxiv-2510.05211","evidence_file":"phase2/evidence/arxiv-2510.05211.evidence.json","evidence_ids":["pending-id-normalization"],"review_status":"provisional","confidence":0.85,"notes":"Subclass/extension relation."},
    {"id":"e016","source":"paper:2602.07578","target":"code:bb","type":"studies","source_paper_id":"arxiv-2602.07578","evidence_file":"phase2/evidence/arxiv-2602.07578.evidence.json","evidence_ids":["pending-id-normalization"],"review_status":"provisional","confidence":0.95,"notes":"Primary code family."},
    {"id":"e017","source":"paper:2602.07578","target":"noise:erasure","type":"evaluates_under","source_paper_id":"arxiv-2602.07578","evidence_file":"phase2/evidence/arxiv-2602.07578.evidence.json","evidence_ids":["pending-id-normalization"],"review_status":"provisional","confidence":0.95,"notes":"Erasure regime is central to the paper."},
    {"id":"e018","source":"paper:2602.07578","target":"noise:circuit-level","type":"evaluates_under","source_paper_id":"arxiv-2602.07578","evidence_file":"phase2/evidence/arxiv-2602.07578.evidence.json","evidence_ids":["pending-id-normalization"],"review_status":"provisional","confidence":0.80,"notes":"Exact circuit-level assumptions must be checked before promotion."}
  ]
}
